id,location_id,program_id,accepted_payments,alternate_name,application_process,description,eligibility,email,fees,funding_sources,interpretation_services,keywords,languages,name,required_documents,service_areas,status,wait_time,website,taxonomy_ids
5236,5236,5236,,,Contact the Admissions Specialist at the main number for initial assessment.\nBring insurance card and/or proof of household income.,None Provided,,,,,,,,DAVID LAWRENCE CENTER - CROSSROADS RESIDENTIAL,,,active,,http://crossroadsnaples.org/,
5237,5237,5237,,,Initial assessment required.  \nBring insurance card and/or proof of household income.,None Provided,,,,,,,,DAVID LAWRENCE CENTER - MENTAL HEALTH AND SUBSTANCE ABUSE OUTPATIENT TREATMENT,,,active,,http://www.DavidLawrenceCenter.org,
5238,5238,5238,,,* Parents must pre-register their children on organization website before arriving to center. \n* Call for more information.,None Provided,,,,,,,,"HOLY FAITH MISSIONARY BAPTIST CHURCH, INC.",,,active,,http://www.holyfaithmbc.org/,
5240,5240,5240,,,Must call to enroll child in the program,None Provided,,,,,,,,"IMMOKALEE CHILD CARE CENTER, INC.",,,active,,http://www.immokaleechildcarecenter.org/,
5244,5244,5244,,,Must call to register for literacy program of interest,None Provided,,,,,,,,"LITERACY VOLUNTEERS OF COLLIER COUNTY, INC.",,,active,,http://www.collierliteracy.org,
5249,5249,5249,,,Call for more information,None Provided,,,,,,,,"RECAPTURING THE VISION INTERNATIONAL, INC.",,,active,,http://rtv.org/,
5251,5251,5251,,,None,None Provided,,,,,,,,EPILEPSY SERVICES OF SOUTHWEST FLORIDA - PREVENTION AND EDUCATION,,,active,,http://www.epilepsy-services.org/,
5252,5252,5252,,,Visit site for evaluation assessment from there an appointment will be scheduled upon funding being available,None Provided,,,,,,,,"IMMOKALEE MULTICULTURAL MULTIPURPOSE COMMUNITY ACTION AGENCY, INC.",,,active,,,
5261,5261,5261,,,Must be screened by local social service agencies; call for more information,None Provided,,,,,,,,"BABY BASICS OF COLLIER COUNTY, INC.",,,active,,http://babybasicscollier.org,
5265,5265,5265,,,Contact the Membership Specialist,None Provided,,,,,,,,"GIRL SCOUTS OF GULFCOAST FLORIDA, INC.",,,active,,http://www.gsgcf.org,
5269,5269,5269,,,"Walk-in services may have to wait, this service not available on Monday's. \nAppointments are highly encouraged.",None Provided,,,,,,,,PLANNED PARENTHOOD - NAPLES HEALTH CENTER,,,active,,http://www.plannedparenthood.org/health-center/centerDetails.asp?f=3294&a=90285&v=details,
5270,5270,5270,,,"Walk-in services may have to wait, this service not available on Monday's. \nAppointments are highly encouraged.",None Provided,,,,,,,,PLANNED PARENTHOOD - IMMOKALEE HEALTH CENTER,,,active,,http://www.plannedparenthood.org/health-center/centerDetails.asp?f=3294&a=90285&v=details,
5271,5271,5271,,,The Hunger & Homeless Coalition does not provide direct service intake. Provider agencies interested in becoming members of the Hunger & Homeless Coalition or the Homeless Continuum of Care may learn more about membership by visiting our website www.collierhomelesscoalition.org,None Provided,,,,,,,,"COLLIER COUNTY HUNGER AND HOMELESS COALITION, INC.",,,active,,http://www.collierhomelesscoalition.org,
5273,5273,5273,,,Registration at agency office,None Provided,,,,,,,,GRACE PLACE - BRIGHT BEGINNINGS,,,active,,http://www.graceplacenaples.org,
5275,5275,5275,,,Registration at agency office,None Provided,,,,,,,,GRACE PLACE - MOMMY AND ME DEVELOPMENTAL PLAYGROUP,,,active,,http://www.graceplacenaples.org,
5276,5276,5276,,,Registration at agency office,None Provided,,,,,,,,GRACE PLACE - ACADEMY OF LEADERS (K - 5),,,active,,http://www.graceplacenaples.org,
5277,5277,5277,,,Registration at agency office; Picture ID and proof of Collier County Residency,None Provided,,,,,,,,GRACE PLACE - FRIDAY FOOD PANTRY,,,active,,http://www.graceplacenaples.org,
5279,5279,5279,,,Registration at agency office,None Provided,,,,,,,,GRACE PLACE - ADULT EDUCATION PROGRAM,,,active,,http://www.graceplacenaples.org,
5280,5280,5280,,,Registration at agency office,None Provided,,,,,,,,GRACE PLACE - ACADEMY OF LEADERS (6 - 8),,,active,,http://www.graceplacenaples.org,
5281,5281,5281,,,Registration at agency office,None Provided,,,,,,,,GRACE PLACE - SUMMER PROGRAM (K-8),,,active,,http://www.graceplacenaples.org,
5284,5284,5284,,,Applicants must visit the office for a pre-qualifying interview and to receive an application.,None Provided,,,,,,,,HABITAT FOR HUMANITY - NAPLES,,,active,,https://www.habitatcollier.org/,
5295,5295,5295,,,"* Unless it is an emergency, appointments are required. \n* Must bring a valid ID, birth certificate for infant, social security card if available, proof of family income or valid insurance card.",None Provided,,,,,,,,HEALTH CARE NETWORK OF SOUTHWEST FLORIDA - NORTH FAMILY PRACTICE,,,active,,http://www.healthcareswfl.org,
5296,5296,5296,,,Please call to confirm hours before visiting office,None Provided,,,,,,,,"UNITED ARTS COUNCIL OF COLLIER COUNTY, INC.",,,active,,http://www.CollierArts.com,
5298,5298,5298,,,Must fill out an application online or at office.,None Provided,,,,,,,,"FRIENDS OF FOSTER CHILDREN OF SWFL, INC.",,,active,,http://www.FriendsofFosterChildren.net,
5312,5312,5312,,,Call for more information. If it is a Spanish caller please do a warm transfer to assist in interpreting as no one at the organization speaks Spanish.,None Provided,,,,,,,,"FOUNDATION FOR THE DEVELOPMENTALLY DISABLED, INC.",,,active,,http://www.fddswfl.org,
5315,5315,5315,,,None,None Provided,,,,,,,,GREATER NAPLES CHAMBER OF COMMERCE - VISITOR INFORMATION CENTER,,,active,,http://www.napleschamber.org,
5318,5318,5318,,,"Call (239) 775-4555 to initiate pre-screen for eligibility. Intake by appointment only.  Clients must provide all information requested at intake, which will include information on income and assets.",None Provided,,,,,,,,LEGAL AID SERVICE OF COLLIER COUNTY - HOUSING UNIT,,,active,,http://www.legalaid.org/Collier,
5319,5319,5319,,,"Call to initiate pre-screen for eligibility. Intake by appointment only. \nClients must provide all information requested at intake, which will include information on income and assets.",None Provided,,,,,,,,LEGAL AID SERVICE OF COLLIER COUNTY - IMMIGRATION LAW UNIT,,,active,,http://www.legalaid.org/Collier,
5320,5320,5320,,,"Call to initiate pre-screen for eligibility. Intake done by appointment only. \nClients must provide all information requested at intake, which will include information on income and assets.",None Provided,,,,,,,,LEGAL AID SERVICE OF COLLIER COUNTY - PUBLIC BENEFITS UNIT,,,active,,http://www.legalaid.org/Collier,
5321,5321,5321,,,"Call to initiate pre-screen for eligibility. Intake by appointment only. \nClients must provide all information requested at intake, which will include information on income and assets.",None Provided,,,,,,,,LEGAL AID SERVICE OF COLLIER COUNTY - EDUCATION LEGAL RIGHTS UNIT,,,active,,http://www.legalaid.org/Collier,
5322,5322,5322,,,"Call to initiate pre-screen for eligibility. Intake by appointment only.\nClients must provide all information requested at intake, which will include information on income and assets.",None Provided,,,,,,,,LEGAL AID SERVICE OF COLLIER COUNTY - LOW INCOME TAXPAYER CLINIC UNIT,,,active,,http://www.legalaid.org/Collier,
5323,5323,5323,,,"Call to initiate pre-screen for eligibility. Intake by appointment only.\nClients must provide all information requested at intake, which will include information on income and assets.",None Provided,,,,,,,,LEGAL AID SERVICE OF COLLIER COUNTY - CARE PRO BONO PROGRAM,,,active,,http://www.legalaid.org/Collier,
5324,5324,5324,,,"Call to initiate pre-screen for eligibility. Intake by appointment only. \nClients must provide all information requested at intake, which includes income and assets.",None Provided,,,,,,,,LEGAL AID SERVICE OF COLLIER COUNTY - OUTREACH OFFICE,,,active,,http://www.legalaid.org,
5329,5329,5329,,,Call for more information.,None Provided,,,,,,,,FELLOWSHIP OF CHRISTIAN ATHLETES - NAPLES,,,active,,http://swfloridafca.org,
5330,5330,5330,,,"Call (239) 643-2143 for information about services, prices and appointments.",None Provided,,,,,,,,HUMANE SOCIETY OF NAPLES,,,active,,http://www.hsnaples.org,
5342,5342,5342,,,Call for an appointment.,None Provided,,,,,,,,SUNRISE COMMUNITY - NAPLES,,,active,,http://www.sunrisegroup.org,
5344,5344,5344,,,Please call to make an appointment,None Provided,,,,,,,,"NUEVA AMERICA, INC.",,,active,,,
5347,5347,5347,,,"* Must make appointment and interview.\r\n* Must provide proof of residency, physicians statement, and financial proof.",None Provided,,,,,,,,CANCER ALLIANCE OF NAPLES - FINANCIAL ASSISTANCE,,,active,,http://www.cancerallianceofnaples.com,
5350,5350,5350,,,"The parent must fill out an application and register child(ren) and must know the last four digits of their child's SSN as well as their child's student ID number.  \n\nMust bring proof of child health insurance (if none parents will be assisted in obtaining health insurance)\n\nSummer Reading Explorers:\nParents must fill out Parental Consent Form to release educational records (non-medical) for Summer Reading Explorers Program participants. This is used to evaluate the child for eligibility purposes only.\n\nNote: if child has any disabilities, parent must bring in proof of their child's disability.",None Provided,,,,,,,,GANG ALTERNATIVE - GUIDING THE PATH TO SUCCESS OUT OF SCHOOL (GPS),,,active,,http://www.myga.org,
5351,5351,5351,,,"Must fill out an application and register child(ren). Must know their child's last four digits of their SSN and student ID number. \nPlease Note: if child has any disabilities, parent should bring in proof of any kind of their child's disability.",None Provided,,,,,,,,GANG ALTERNATIVE - BUILDING LEADERS OF CHARACTER,,,active,,http://www.myga.org,
5352,5352,5352,,,Call for information,None Provided,,,,,,,,HOPE FOR MIAMI - CHILDREN OF INMATES,,,active,,http://www.hopeformiami.org,
5354,5354,5354,,,None,None Provided,,,,,,,,AMERICAN CANCER SOCIETY - COLLIER COUNTY UNIT,,,active,,http://www.cancer.org,
5356,5356,5356,,,"If it is the client's first time receiving food they can come to the location during administrative hours for immediate assistance, they will be registered into the program and will then be provided a calendar with dates and times of services.",None Provided,,,,,,,,CITYREACH MINISTRIES - FOOD DISTRIBUTION,,,active,,http://www.cityreachministries.com/,
5363,5363,5363,,,"Can apply and register online or call to register\r\nMore information on supply list, etc. located on the website",None Provided,,,,,,,,MARCO ISLAND CENTER FOR THE ARTS,,,active,,http://www.marcoislandart.org/,
5365,5365,5365,,,"Call for more information, varies depending on program",None Provided,,,,,,,,"BOYS AND GIRLS CLUB OF COLLIER COUNTY, INC.",,,active,,http://www.bgccc.com/,
5368,5368,5368,,,Parents must compete a registration package and provide copy of last report card (if available). \nStudents with disabilities must provide IEP or complete a Parent Disclosure Form.,None Provided,,,,,,,,KNOWLEDGE BUILDERS OF FLORIDA - AFTER SCHOOL PROGRAM,,,active,,http://kb-florida.org,
5370,5370,5370,,,Call to register.\r\nDeadline for scholarship application for Session 1 is May 25 and one week before each of the other three sessions.,None Provided,,,,,,,,THE NAPLES PLAYERS - KIDZ ACT,,,active,,http://www.naplesplayers.org,
5373,5373,5373,,,"The organization's representative must sign a document accepting responsibility to review and approve all content and subject matter before the books are placed into circulation.\n\nOnce the application is submitted and approved, books are provided and new books are purchased.",None Provided,,,,,,,,K IS FOR KIDS FOUNDATION - FRIENDS OF THE SCHOOL LIBRARY,,,active,,http://www.kisforkids.org/friends-of-the-school-library/,
5374,5374,5374,,,Call to enroll in the program,None Provided,,,,,,,,K IS FOR KIDS FOUNDATION - BUILDING BOOK NOOKS FOR KIDS,,,active,,http://www.kisforkids.org/building-book-nooks-for-kids/,
5375,5375,5375,,,Call for more information,None Provided,,,,,,,,K IS FOR KIDS FOUNDATION - RISING READERS,,,active,,http://www.KisforKids.org,
5377,5377,5377,,,Call for more information.,None Provided,,,,,,,,CHAMPIONS FOR LEARNING - GET ON THE BUS OUTREACH PROGRAM,,,active,,http://www.educationforcollier.org,
5378,5378,5378,,,"Create a user profile, post the classroom request online, approval by principal and The Education Foundation - Champions For Learning. wwwchampionsforlearning/Connectwithaclassroom.",None Provided,,,,,,,,CHAMPIONS FOR LEARNING - CONNECT WITH A CLASSROOM GRANT PROGRAM,,,active,,http://finditfunditflorida.com/collier/,
5379,5379,5379,,,Applications available from public school counselors and from The Education Foundation - Champions For Learning only in the fall of the student's 8th grade year.,None Provided,,,,,,,,CHAMPIONS FOR LEARNING - TAKE STOCK IN CHILDREN,,,active,,http://www.championsforlearning.org,
5384,5384,5384,,,Parent must meet with supervisor. \nApplication required.,None Provided,,,,,,,,HOPE FOR MIAMI - SUCCESS YOUTH AFTER SCHOOL AND SUMMER CAMP - IGLESIA BAUTISTA ESTRELLA DE BELEN,,,active,,http://www.hopeformiami.org,
5385,5385,5385,,,Call for information,None Provided,,,,,,,,SUSAN G. KOMEN FOR THE CURE - SOUTHWEST FLORIDA,,,active,,http://www.Komenswfl.org,
5388,5388,5388,,,Must fill out an application and must sign a medical release form.,None Provided,,,,,,,,LIGHTHOUSE OF COLLIER - INDEPENDENT LIVING SKILLS,,,active,,http://www.lighthouseofcollier.org,
5389,5389,5389,,,Parent must fill out an application and consent to release medical forms. Further screening will be made after intake.,None Provided,,,,,,,,LIGHTHOUSE OF COLLIER - CHILDREN'S PROGRAMS,,,active,,http://www.lighthouseofcollier.org,
5396,5396,5396,,,For financial screening must first call and setup an appointment to fill out an application form\n\nWalk-in Services: Only for birth control and bladder infection treatment,None Provided,,,,,,,,"WOMANKIND, INC.",,,active,,http://womankindkeywest.com/,
5398,5398,5398,,,* Open to high school students attending participating high schools.\n* High schools interested in having a SHAPE club at their school.,None Provided,,,,,,,,"STUDENTS HELPING ACHIEVE PHILANTHROPIC EXCELLENCE, INC.",,,active,,http://www.shapestudents.org,
5404,5404,5404,,,"Photo ID, proof of income, Social Security, and utility bill.",None Provided,,,,,,,,CATALYST MIAMI - HEALTH INSURANCE ENROLLMENT - DOWNTOWN MIAMI,,,active,,http://www.catalystmiami.org,
5407,5407,5407,,,Please visit the website for further requirements needed and to apply for a grant,None Provided,,,,,,,,"COMMUNITY FOUNDATION OF COLLIER COUNTY, INC.",,,active,,http://www.cfcollier.org,
5409,5409,5409,,,"* Call for appointment, walk-ins are welcome.\n* Must complete consent form.",None Provided,,,,,,,,UM - JTMF SCHOOL HEALTH INITIATIVE - FULFORD ELEMENTARY,,,active,,http://familymedicine.med.miami.edu/,
5410,5410,5410,,,"Call for appointment, walk-ins are welcome.\nMust complete our consent form.",None Provided,,,,,,,,UM - JTMF SCHOOL HEALTH INITIATIVE - GREYNOLDS PARK ELEMENTARY,,,active,,http://www.familymedicine.med.miami.edu/,
5411,5411,5411,,,"* Call for appointment, walk-ins are welcome.\n* Must complete our consent form.",None Provided,,,,,,,,UM - JTMF SCHOOL HEALTH INITIATIVE - GERTRUDE EDELMAN/SABAL PALM ELEMENTARY,,,active,,http://www.familymedicine.med.miami.edu/,
5423,5423,5423,,,* Call to schedule screening \n* Required physical exam and laboratory work-up,None Provided,,,,,,,,OPERATION PAR - MEDICATION ASSISTED PATIENT SERVICES,,,active,,http://operationpar.org/maps/maps.htm,
5432,5432,5432,,,Call for more information,None Provided,,,,,,,,"COLLEGE SUMMIT, INC.",,,active,,http://www.collegesummit.org/,
5434,5434,5434,,,Call for more information.,None Provided,,,,,,,,I HAVE A DREAM - OVERTOWN INC.,,,active,,http://www.ihaveadream-overtown.org,
5437,5437,5437,,,Call for more information,None Provided,,,,,,,,CONSERVANCY OF SOUTHWEST FLORIDA - ENVIRONMENTAL EDUCATION,,,active,,http://www.conservancy.org,
5438,5438,5438,,,Call to register,None Provided,,,,,,,,CONSERVANCY OF SOUTHWEST FLORIDA - GOOD FORTUNE II NATURE CRUISES,,,active,,http://www.conservancy.org/goodfortune,
5439,5439,5439,,,Must call to make an appointment for initial screening,None Provided,,,,,,,,"SALUSCARE, INC.",,,active,,http://www.saluscareflorida.org,
5457,5457,5457,,,Call for information.,None Provided,,,,,,,,BREAKTHROUGH MIAMI - PALMER TRINITY SCHOOL,,,active,,http://www.breakthroughmiami.org,
5465,5465,5465,,,Call for information,None Provided,,,,,,,,MIAMI COALITION OF CHRISTIANS AND JEWS - DIVERSITY/LEADERSHIP TRAINING,,,active,,http://www.miamiccj.org,
5467,5467,5467,,,Referrals or call for appointment,None Provided,,,,,,,,NEW HORIZONS - MISSING LINK YOUTH DEVELOPMENT PROGRAM,,,active,,http://www.NewHorizonsCMHC.org,
5471,5471,5471,,,Kids can get dropped off at club on their own or with friends.,None Provided,,,,,,,,YOUNG LIFE - WYLDLIFE NAPLES,,,active,,http://ylcc.younglife.org/Pages/default.aspx,
5472,5472,5472,,,Call for more information,None Provided,,,,,,,,YOUNG LIFE - CAMP,,,active,,http://ylcc.younglife.org/Pages/default.aspx,
5473,5473,5473,,,Call for more information,None Provided,,,,,,,,YOUNG LIFE - CAPERNAUM,,,active,,http://ylcc.younglife.org/Pages/default.aspx,
5489,5489,5489,,,"The client or the referral source (DOC, USPO/USPSO or other community agency) may call 305-704-0131 to schedule an appointment at any of our 3 locations.  \r\nThe referral document can also be faxed to 305-704-0155 and our staff will contact the client directly.",None Provided,,,,,,,,ADVOCATE PROGRAM - CLINICAL SERVICES UNIT - SOUTH DADE,,,active,,http://www.advocateprogram.org,
5490,5490,5490,,,"The client or the referral source (DOC, USPO/USPSO or other community agency) may call 305-704-0131 to schedule an appointment at any of our 3 locations.  \r\nThe referral document can also be faxed to 305-704-0155 and our staff will contact the client directly.",None Provided,,,,,,,,ADVOCATE PROGRAM - CLINICAL SERVICES UNIT - NORTH DADE,,,active,,http://www.advocateprogram.org,
5495,5495,5495,,,"Complete required intake forms, provide proof of insurance, and reason for visit",None Provided,,,,,,,,"DR. L MITCHELL AND ASSOCIATES, PA",,,active,,http://www.drlmitchell.com,
5507,5507,5507,,,Call for appointment.,None Provided,,,,,,,,NAPLES POLICE DEPARTMENT - CRIME PREVENTION EDUCATION,,,active,,http://www.naplespolice.com,
5508,5508,5508,,,Take your bicycle to the police headquarters lobby for service,None Provided,,,,,,,,NAPLES POLICE DEPARTMENT - BICYCLE REGISTRATION PROGRAM,,,active,,http://www.naplespolice.com,
5510,5510,5510,,,Visit police headquarters lobby during program hours and days.\n\nProof Of City Residency Required:\n* Property Tax Bill\n* City Utility Bill\n* Photo I.D.,None Provided,,,,,,,,NAPLES POLICE DEPARTMENT - PUBLIC FINGERPRINTING SERVICES,,,active,,http://www.naplesgov.com/index.aspx?NID=506,
5526,5526,5526,,,Parents must complete health history intake forms for the student. Forms are available in the school health clinic.,None Provided,,,,,,,,NICKLAUS CHILDREN'S HOSPITAL - SCHOOL HEALTH PROGRAM - ROYAL PALMS ELEMENTARY SCHOOL,,,active,,https://www.nicklauschildrens.org/home.aspx,
5529,5529,5529,,,Call for an interview,None Provided,,,,,,,,BIG BROTHERS BIG SISTERS OF THE SUN COAST - COLLIER - ONE ON ONE MENTORING,,,active,,http://www.bbbssun.org,
5533,5533,5533,,,Call or visit website to order,None Provided,,,,,,,,SENIORS BLUE BOOK,,,active,,http://www.seniorsbluebook.com,
5537,5537,5537,,,Call for more information,None Provided,,,,,,,,MENTAL HEALTH ASSOCIATION OF SOUTHWEST FLORIDA - CONTINUING EDUCATION,,,active,,http://www.mhaswfl.org,
5538,5538,5538,,,Call for more information,None Provided,,,,,,,,MENTAL HEALTH ASSOCIATION OF SOUTHWEST FLORIDA - INFORMATION AND REFERRAL,,,active,,http://www.mhaswfl.org,
5541,5541,5541,,,Call or visit website to register online,None Provided,,,,,,,,MENTAL HEALTH ASSOCIATION OF SOUTHWEST FLORIDA - DIVORCE PARENTING CLASSES,,,active,,http://www.mhaswfl.org,
5542,5542,5542,,,After School: \nRegistration at the beginning of the Dade-County Public School year and ending. Pick up will be available at the cafeteria from 3:00pm-6:00pm.\n\nSummer Camp: \nRegistration packets will be available at the end of the Dade County Public School year. Pick up will be available at the cafeteria from 3:00pm-6:00pm.\n\nSummer Reading Explorers:\nParents must fill out Parental Consent Form to release educational records (non-medical) for Summer Reading Explorers Program participants. This is used to evaluate the child for eligibility purposes only.,None Provided,,,,,,,,RECAPTURING THE VISION INTERNATIONAL - VISION SMART KIDS - DR. WILLIAM A. CHAPMAN ELEMENTARY,,,active,,http://www.rtv.org,
5545,5545,5545,,,Must make an appointment for an assessment,None Provided,,,,,,,,"RESOLVE COMMUNITY COUNSELING CENTER OF COLLIER COUNTY, LLC.",,,active,,http://www.resolvecounselingnaples.com/,
5547,5547,5547,,,"Call, visit website or visit location for further information on what documents are needed to apply",None Provided,,,,,,,,M-DC TAX COLLECTOR - MOTOR VEHICLE TAX,,,active,,http://www.miamidade.gov/taxcollector/,
5548,5548,5548,,,Call for further information on what is needed for payment of taxes or send an e-mail to: localbusinesstax@miamidade.gov,None Provided,,,,,,,,M-DC TAX COLLECTOR - LOCAL BUSINESS TAX,,,active,,http://www.miamidade.gov/taxcollector/,
5549,5549,5549,,,Call for more information,None Provided,,,,,,,,MENTAL HEALTH ASSOCIATION OF SOUTHWEST FLORIDA - GOLLEE GATOR,,,active,,http://www.mhaswfl.org,
5550,5550,5550,,,Call for information,None Provided,,,,,,,,"LOWER KEYS MEDICAL CENTER, INC.",,,active,,http://www.lkmc.com/locations/lower-keys-medical-center,
5551,5551,5551,,,Call for more information,None Provided,,,,,,,,MENTAL HEALTH ASSOCIATION OF SOUTHWEST FLORIDA - PUBLICATIONS,,,active,,http://www.mhaswfl.org,
5557,5557,5557,,,Must pick up an application at the front desk,None Provided,,,,,,,,PEACE LUTHERAN EARLY LEARNING CENTER - SUMMER CAMP PROGRAM,,,active,,http://peacekidsnaples.org/,
5561,5561,5561,,,"* A reservation is required in advance to bring cats to the Meow Mobile. Walk ups welcomed based on availability. \n* To make an appointment, view the schedule online, and send an e-mail or call. (E-mail for faster response).\n* Once appointment is made please completely fill out and print the GCat Intake Form.G",None Provided,,,,,,,,THE CAT NETWORK - MIAMI MEOW MOBILE,,,active,,http://thecatnetwork.org/help-a-cat/spayneuter/meow-mobile/,
5562,5562,5562,,,Parents must register online via The Children's Trust website: www.thechildrenstrust.org/parents/initiatives/read-to-learn-book-club. Counselor may complete registration online for client if needed. Call 2-1-1 for information.,None Provided,,,,,,,,MIAMI-DADE FAMILY LEARNING PARTNERSHIP - THE CHILDREN'S TRUST READ TO LEARN BOOK CLUB,,,active,,http://www.thechildrenstrust.org/parents/initiatives/read-to-learn-book-club,
5564,5564,5564,,,Call for information,None Provided,,,,,,,,ALZHEIMER'S ASSOCIATION - FLORIDA GULF COAST CHAPTER - CARE CONSULTATION,,,active,,http://www.alz.org/FLGulfCoast,
5567,5567,5567,,,Call for information,None Provided,,,,,,,,ALZHEIMER'S ASSOCIATION - FLORIDA GULF COAST CHAPTER - CAREGIVER TRAINING,,,active,,http://www.alz.org/FLGulfCoast,
5568,5568,5568,,,Call or visit website for more information,None Provided,,,,,,,,ALZHEIMER'S ASSOCIATION - FLORIDA GULF COAST CHAPTER - MEDIC ALERT + SAFE RETURN,,,active,,http://www.alz.org/FLGulfCoast,
5570,5570,5570,,,Call for more information.,None Provided,,,,,,,,ALZHEIMER'S ASSOCIATION - FLORIDA GULF COAST CHAPTER - RESPITE CARE ASSISTANCE,,,active,,http://www.alz.org/FLGulfCoast,
5571,5571,5571,,,Parents must fill out an application form at any of the locations and pay the registration fee.,None Provided,,,,,,,,YMCA - AFTER SCHOOL PROGRAM - VINELAND K-8,,,active,,http://www.ymcamiami.org,
5574,5574,5574,,,Parents must fill out an application form at any of the locations and pay the registration fee,None Provided,,,,,,,,YMCA - AFTER SCHOOL PROGRAM - OJUS ELEMENTARY,,,active,,http://www.ymcamiami.org,
5575,5575,5575,,,Parents must fill out an application form at any of the locations and pay the registration fee,None Provided,,,,,,,,YMCA - AFTER SCHOOL PROGRAM - GRATIGNY ELEMENTARY,,,active,,http://www.ymcamiami.org,
5576,5576,5576,,,Parents must fill out an application form at any of the locations and pay the registration fee.,None Provided,,,,,,,,YMCA - AFTER SCHOOL PROGRAM - NORTH HIALEAH ELEMENTARY,,,active,,http://www.ymcamiami.org,
5578,5578,5578,,,"* Must make an appointment.\n* Must provide proof of income (latest income tax return, 2 paycheck stubs)\n* Proof of Florida residence (copy of social security card or immigration paper, light bill, mortgage or rent receipt)\n* Parent or legal guardian must accompany patient.",None Provided,,,,,,,,CORAL GABLES WOMAN'S CLUB - MAY VAN SICKLE DENTAL CLINIC,,,active,,http://www.coralgableswomansclub.com,
5579,5579,5579,,,Must complete registration packet.,None Provided,,,,,,,,YWCA - (YAS) CAMPBELL ARMS AFTER SCHOOL PROGRAM,,,active,,http://www.ywca-miami.org,
5580,5580,5580,,,Must complete registration packet.,None Provided,,,,,,,,YWCA - (YAS TEENS) HENRY FILER MIDDLE AFTER SCHOOL PROGRAM,,,active,,http://www.ywca-miami.org,
5582,5582,5582,,,Parents must fill out an application form at any of the locations and pay the registration fee,None Provided,,,,,,,,YMCA - AFTER SCHOOL PROGRAM - NORTH DADE CENTER FOR MODERN LANGUAGE,,,active,,http://www.ymcamiami.org,
5588,5588,5588,,,Call for information,None Provided,,,,,,,,CITY OF NAPLES FIRE - FIRE SAFETY,,,active,,http://www.naplesfire.com,
